neg,neu,pos,compound,Headline,Text,Date Created,Upvotes,Sentiment Label
0.03,0.877,0.093,0.7211,Last $500,"I recently sold some other stocks and had 7k to put into BTC. I m already DCA every day so I want to time the dips with the 7k.
I have bought $500 every 1k BTC dropped in the last 24 hours.  I have $500 left. If I follow the pattern I should have bought at 88k but decided to wait and see if it drops more.

Finally my question... Should I try and buy at 85k? What do you guys think it will go down too? 
I understand no one knows but I would like opinions..   thanks ",1740492176.0,1.0,Positive
0.066,0.89,0.044,-0.8606,The First Meme of D.O.G.E $HFC,"HOW DID THEY START?

The government spent 3 MILLION dollars of YOUR money, YOUR tax money into a facility where they injected hamsters with drugs such as steroids and cocaine to get them buff and fight each other in a cage... Sounds absurd right? You think it's a fiction story book right? Wrong!



WHERE DID THE MEME START?

It was a chain reaction, Senator Rand Paul made a tweet addressing the situation, and then the man himself, ELON MUSK quoted that tweet, and sent the most legendary reply known to humans. It was a simple hamster emoji...



THE TEAM

Everyone who is a part of the hamsterhood, or even thought about the ideology of the token is a part of the team, but our CTO lead team is comprised of a variety of ages, jobs, ethnicities. It's just a group of people who thought this shit is HERE TO STAY



WHAT DO WE STAND FOR?

This is a HAMSTERHOOD, everyone is part of the community and the backbone of the project, we are together. We will get out of the HAMSTER RACE together, this endless cycle of lies, we want freedom from the life we have been imprisoned into! We will break that together with this coin, its starts here!



WHERE ARE WE GOING?

We are headed straight for the summit, the never ending cycle of betterment, and we aren't stopping, we strive to be the token that restructures what it means to be part of a token, we want to change the game. To do that, we have a detailed roadmap on our website , we will get ahead due to our team and community with the belief in this, together.



[https://hamsterfight.club](https://hamsterfight.club)",1740442430.0,1.0,Negative
0.064,0.838,0.097,0.7096,ODINDOG – The Meme Coin Leading the Charge on Bitcoin’s Odin.fun,"Bitcoin has always been the king of crypto, but when it comes to meme coins, it’s been playing catch-up to faster, lower-fee blockchains like Solana. ODINDOG is changing that by launching on Odin.fun, a platform that brings fast, low-cost meme trading to BTC.

Unlike traditional Bitcoin-based assets that suffer from high fees and slow transactions, Odin.fun has built a system that enables near-instant trades with 2-second finality and significantly lower costs than Runes. This makes it a game-changer for Bitcoin-based meme coins and positions ODINDOG as a potential first-mover in this space.

Here’s why ODINDOG and Odin.fun have potential:

Bitcoin is the OG – Meme coins thrive on speculation and hype, and bringing that culture to Bitcoin could be massive.

Odin.fun eliminates the usual Bitcoin drawbacks – No need to deal with slow confirmation times or ridiculous fees.

ODINDOG is the leading token – As the first major meme coin on Odin.fun, it has a strong positioning in a growing ecosystem.


We’ve seen meme coins on other blockchains explode in popularity—if the same happens on Bitcoin, ODINDOG could be one of the biggest winners.

Do your own research, but this might be worth keeping an eye on.",1740463466.0,1.0,Positive
0.056,0.911,0.033,-0.4847,Crypto Market in the Red!,"https://preview.redd.it/jebkmcsd49le1.png?width=1910&format=png&auto=webp&s=929d45b0bed00ccdf4e20538f621cba607aeeed9

This morning, the crypto market **took a sharp downturn**, with most top assets seeing **double-digit losses**. Here’s the latest update:

📉 **BTC** – $89,529 (-6.28%)  
📉 **ETH** – $2,403 (-10.53%)  
📉 **AVAX** – $21.18 (-10.50%)  
📉 **XRP** – $2.19 (-10.88%)  
📉 **DOGE** – $0.20 (-10.64%)  
📉 **SUI** – the biggest drop at **-14.19%!**

📊 **A few exceptions:**  
✔️ **WBT** dropped only -1.29%  
✔️ **ADA** is down -9.47%, but not as drastically as others.

**What’s happening?**  
The market is under heavy pressure, likely due to a broad correction and profit-taking by large players. **Is this the start of a deeper dip or a buying opportunity?**",1740474544.0,1.0,Negative
0.168,0.691,0.141,-0.6222,Stop being scared,"Everyone is negative and it's in a mass panic cause $crypto is down this is the opportunity to buy more for a low price and the fudsters are flooding every social media channel to scare you out of the market. Yes crypto is volatile and this is where you make money last year the same happened everyone was afraid and sold and i buyed when they selling in fear in the end i made 1589$ in profit unleveraged. Stop being scared, see the opportunity and use it and stop trying to be rich tomorrow morning build your wealth brick by brick volatility is opportunity and mindset  matters if you don't belive what you are doing and too scared switch to bonds and dividend stocks.  $BTC $XRP $LTC $ETH ",1740488974.0,1.0,Negative
0.0,0.864,0.136,0.8642,How low-ish could Btc go?,"I know, nobody can say exact numbers, and that is also not what i’m asking. But to the people who are in crypto for many many years, how low-ish can crypto go this time? I’m quite new into crypto, especially regarding buying the dip, should i wait little more or buying it now?

Any tips and help is appreciated!",1740492086.0,1.0,Positive
0.22,0.78,0.0,-0.8291,Bitcoin is Fine,"I keep seeing people on here panic about Bitcoin *'dropping,'* but when I check my wallet, all my sats are there as expected. 

Not sure what the issue is. Maybe you guys are doing something wrong?",1740442210.0,0.91,Negative
0.0,1.0,0.0,0.0,Cosmo and Wanda aren’t just fairies—they’re my Bitcoin guardians,"Shoutout to trezor , BITCOIN ONLY FIRMWARE ON BOTH. They aren’t just fairy godparents, these two hold the keys to my future",1740455985.0,0.88,Neutral
0.104,0.742,0.155,0.1635,Ultimate Bag Holder - Corporate Edition,"Been watching his videos on BTC, looks like he's running out of ways and names to pump/hype BTC. Economic Armour/Apex property/Global Capital/Economic Energy? Lmao! At this point is just pathetic, what do you expect he'll say, obviously he'll ask you, USA and other countries to hold/pump his bags. 

I actually like BTC but people like this make me hate this community.
",1740443705.0,0.87,Positive
0.0,0.835,0.165,0.7109,Could this be the best time to buy BTC?,BTC has been dropping abruptly in the last 24hours and I am considering pumping money into it now. Is this a good time? Should I wait a little longer? Is there a chance it will further plummet? ,1740479834.0,0.84,Positive
0.027,0.834,0.139,0.8519,2024 Change in Bitcoin Ownership,"In 2024 alone:

• Individuals offloaded 525K BTC  
• Meanwhile, funds and ETFs added 519K  
• Businesses followed suit, scooping up 374K BTC.

Retail continues to buy memecoins and shitcoins in the hope of 'getting rich quick'

Institutions are buying Bitcoin knowing it's the winner.

95% of the worlds largest investors own 0 BTC and yet, 95% of BTC are owned.

The squeeze is coming.

Stack sats and HODL

https://preview.redd.it/67psyee8q4le1.jpg?width=1280&format=pjpg&auto=webp&s=71000f0275f67643e7242ef84270bbfe5b9fffff

  
",1740421379.0,0.83,Positive
0.04,0.85,0.109,0.8416,River,"About 6months into my BTC journey and have been doing research here and there. Why wouldn’t everyone use their cash to get 3.8% to convert to bitcoin it kinda seems too good to be true with their calculator on their website at a 10k deposit for easy numbers over 5 years would output 6k whereas with a HYS at 4.5% that’s only outputs 2,250 like is my math wrong or are there hidden fees that I don’t know about someone with knowledge on this topic please help me understand why I shouldn’t just do a full push into river.

Edit: Apologies for the grammar it’s not my strong suit. My main question is… Why would someone use a HYS (4.5%) over using River account (3.8% based on btc coins price) that makes more return on satoshi from cash?",1740437150.0,0.8,Positive
0.105,0.895,0.0,-0.4019,is 1 whole btc still a realistic goal for avg investor?,"even with this dip or eventually crash ( 70/80k ) , still being considered as reachable for average person who wants to get a seat on this rocket ? ",1740453237.0,0.8,Negative
0.0,1.0,0.0,0.0,BTC Price Keeps Dropping Despite Strategy’s Latest $2B Bitcoin Purchase,"BTC Price Keeps Dropping Despite Strategy’s Latest $2B Bitcoin Purchase  
[https://cryptopotato.com/btc-price-keeps-dropping-despite-strategys-latest-2b-bitcoin-purchase/](https://cryptopotato.com/btc-price-keeps-dropping-despite-strategys-latest-2b-bitcoin-purchase/)  
For more investing news: [https://candorium.com/latest-news/investing](https://candorium.com/latest-news/investing)",1740432665.0,0.8,Neutral
0.0,0.859,0.141,0.8402,Beginner,"Okay so l've been doing my best to try and learn the basics of crypto and how to invest. I've spend around £1200 (£500 BTC, £300 SOL, £200 XRP,
£200 SUI) probably be able to put in a couple hundred per month and just wondering if this is a good divide or do l have my eggs in too many baskets?",1740415937.0,0.75,Positive
0.112,0.758,0.13,0.8442,Maybe crushes are blessings in disguise,"very few folks have remained unshaken by the recent crypto crushes, especially the ones that have been occurring in the last couple of weeks. But, wait, these crushes, may be blessings in disguise. Let me explain what I mean. 

In Q1 of 2024, Bitcoin (BTC) surged over 65%, rising from $44,167 to over $73,000, a stark contrast to previous halving years. Unlike past cycles, altcoins also rallied despite global quantitative tightening (QT), fueled by Bitcoin ETF approvals and anticipated rate cuts.

However, in Q1 of 2025, a post-halving period that typically sparks an altseason, altcoins are struggling even with quantitative easing (QE) on the horizon. One key reason is that Q1 2024 absorbed excessive liquidity, keeping alt valuations high and reducing their potential for parabolic growth. Unlike past cycles, where altcoins entered the post-halving phase deeply undervalued, many remain too expensive for whales seeking significant multiples.

Other factors also contribute to the delay. The explosion of meme coins has diluted liquidity, limiting capital inflows into established altcoins. Macroeconomic risks, such as Trump’s tariff threats, regulatory uncertainty, and geopolitical tensions, have driven investors toward safer assets. Additionally, the dominance of Bitcoin and Ethereum ETFs has funneled institutional liquidity away from smaller coins. Retail traders, many still underwater from 2024, remain hesitant to rotate into altcoins.

Furthermore, blockchain adoption has lagged behind speculation. Unlike previous cycles driven by strong narratives like ICOs in 2017 or DeFi in 2020, no new major trend has emerged to reignite demand. Meanwhile, rising yields on stablecoins and traditional finance instruments like U.S. Treasuries offer attractive passive income, diverting capital from speculative markets.

That said, the frequent market crashes could be a blessing in disguise. These corrections create conditions for whales to re-enter at discounted prices, setting the stage for a future altcoin rally. However, another key factor delaying altseason is the unusually high market capitalization of altcoins at present. Historically, alts have entered the post-halving phase with much lower valuations, leaving ample room for explosive gains. In contrast, the elevated alt market cap now makes it harder for major players to justify aggressive accumulation. With QE expected to inject fresh liquidity, institutional and high-net-worth investors may start rotating back into alts once conditions stabilize, but this process may take longer than in previous cycles.

While altseason may still arrive later in 2025, its delay is driven by a mix of liquidity exhaustion, unusually high alt market cap, macro risks, and shifting investor behavior. Until a fresh catalyst emerges, Bitcoin and Ethereum will likely maintain dominance, while altcoins remain in consolidation—potentially setting the stage for the next wave of exponential growth.",1740441986.0,0.74,Positive
0.066,0.839,0.094,0.643,"Stop panicking, this is good","Its always entertaining watching the flipflopping of opinions in this sub. People need to recognise when they're presented with a good opportunity.

BTC has been consolidating for months and finally the bandage is torn off to properly retest the Bull Market Support Band. This happens every fucking cycle, multiple times. BTC can't constantly go up without testing support levels.

Alts are getting wrecked on their BTC pairs because the US is still in QT. By June, QT will end and Powell in the coming months will make it clear when QE will begin. There's a squeeze on finances and the labour market right now creating uncertainty. Volatile markets hate uncertainty and Alts are the most volatile of all assets.

There's a reason huge funds have been buying massive amounts of ETH and BTC over the past 4 months. They know QE will reverse the trend and BTC/ETH will front run alts, dragging up their USD and BTC valuations.

People calling for the end of the bull run have zero fucking clue what they're talking about. This cycle is more politicised than ever but if the trend isn't broke, don't bet against it. Alt valuations are essentially doing the same as early 2020 - reset all/majority of gains and rally following stimulus packages, QE and lower rates. You're being gamed by big money if you sell into a massive loss right now. Just DCA and stop looking at the charts every second. There's grass outside you know.",1740480198.0,0.74,Positive
0.154,0.641,0.204,0.2712,So what happened to the Trump effect?,"We all seemed so convinced that Trump would send btc to the moon. 

What happened? My first take: Instead of clarity and security, his actions bring the exact opposite: chaos and insecurity.",1740485611.0,0.72,Positive
0.0,1.0,0.0,0.0,Buying BTC on Coinbase,"I go to purchase BTC on Coinbase for $91,411(current price) but when I go review my purchase, it says I'm buying BTC priced at 92,233?. So about 1,000 more than what the price actually is.",1740441651.0,0.71,Neutral
0.029,0.853,0.118,0.7579,Drop you're story's of solana changing not only your life but your family around you. I don't wanna hear (wambo broos) cool ur moms have one as well?,"Drop some heartfelt story's I wanna cry( I took my mother and gram out for food and gave them moneh) that's my story 

came from nothing still work my janitor job regardless of how good I am doing hodling btc now dealing with life stuff so pre much arse tight and back to scratch with me after helping my family time to bounce back and do it all again ",1740469666.0,0.7,Positive
0.069,0.787,0.145,0.6588,Anyone have real time updates?,"As the title implies.. I’m curious if anyone has any real time insight on what is driving BTC price down? I read this morning that MS made a BTC purchase of $2B ~ I’d have guessed this would drive the price up. Even if only by a couple of percentage points. No complaints, just curious if I should wait for a greater consolidation to make a bulk purchase. Thanks!",1740442795.0,0.67,Positive
0.072,0.82,0.107,0.8033,Can someone explain (Micro)Strategy's business model?,"Over the past few months I have been watching/listening to a lot of Saylor's presentation. His latest speech was at CPAC.

Can someone explain in concrete terms the business model behind Strategy?



The way I see it now:

\- It works as long as you can keep borrowing at low interest rates vs projected BTC price increase.

\- This is not an actual business. It needs the underlying asset to appreciate indefinitely. Unless Strategy becomes a bank and start offering loans in BTC.



At the same time he argues that the US should buy BTC to solve its debt problem. He suggested that securing between 4 to 6 million BTC would be sufficient to cover the entire US national debt. Wouldn't the US need to sell their BTC to clean their debt?

Or would they just give away their BTC to their creditors?

Considering that the value of BTC depends mostly on people's appetite for it, wouldn't this affect the FIAT value of BTC if the US reduces its exposure?



Short term this works well. Get the US to buy BTC for their reserve --> BTC price increases.

Long term, I don't understand the play (maybe his time horizon is shorter then). So maybe someone can explain it to me. Apologies if this was answered before.",1740411561.0,0.65,Positive
0.0,1.0,0.0,0.0,Should I buy now or we thinking BTC is gonna go below 80k? I have a feeling it’s gonna drop significantly,"so, i’m holding off on buying right this moment. My bags are “ok”, nothing to write home about. I’ve got extra cash to burn so I’m over here salivating at these juicy dips. I know I’m essentially trying to “time the market” but what’s the sentiment among ye’ degens atm?",1740471900.0,0.62,Neutral
0.0,1.0,0.0,0.0,Bitcoin's future?,Is BTC something that will eventually become currency or will we simply sell it back into the currency form which we bought it?,1740421127.0,0.61,Neutral
0.135,0.804,0.061,-0.6584,"#24 in coinmarketcap and 0,00318BTC?! What is wrong with BCH?","I had my first BCH's with the fork and added within years. You wouldn't imagine the loss. I really can't understand the market decision about BCH. What is the problem? Why can't we attract institutions? Why does LTC marketcap nearly doubled BCH marketcap?

I am not asking those questions to break spirit. Just addressing the problems.",1740439594.0,0.61,Negative
0.0,0.959,0.041,0.5845,Are there any more surprises in the future of solana,"I really believe in Solana, and it used to be one of my biggest bags, but I have converted it to btc while they go through this phase of selling of 12 million sol. I just wanna ask before I reinvest in solana. Is this going to happen again? Are they going to be selling off another horde of coins at another stage? Or is this it?

EDIT: Im not asking about memecoins, just if there are more massive solana coin sales in the future like the one on the 1st of March",1740460739.0,0.6,Positive
0.0,0.852,0.148,0.7992,"If companies start putting 1-2% of cash in bitcoin, how much would this gobble up supply?","I was just curious, but if more companies start hoarding BTC on their balance sheets, and if wealthy companies even deploy like 1% of their cash to BTC, and you multiply this by so many public/private companies, lets say even 5% of companies, how much would this impact supply/trading/hoarding? (noob here).",1740451901.0,0.58,Positive
0.0,1.0,0.0,0.0,Btc is down 14% from it's high,"Btc currently trading at 92k. Down 14% from it's high of 106k. It's said that btc falls ~30% before it's next leg up.


What are our thoughts on this?",1740441122.0,0.57,Neutral
0.04,0.96,0.0,-0.2732,Multisig Hierarchical Deterministic Addresses quantum secure?,"I'm moving my current BTC to a multisig.

I plan to spread it across multiple Hierarchical Deterministic addresses.

If I end up spending from one of the addresses and quantum then is able to crack it, does this mean all the other hd addresses are also at risk, even if I never spend from them?",1740424256.0,0.56,Negative
0.119,0.807,0.073,-0.8537,HIgh FOMO,"Hello, currently BTC is dipping and I wanted to ask for your advice on the saving mindset.

I've heard about BTC many times throughout the years but decided to buy it only this month (I did not have any income earlier, so putting away some money wouldn't be possible due to my circumstances). I'm not fretting about fluctuations and volatility, as I plan to accumulate BTC over the course of the next 10-15 years. However, I can't shake off this FOMO - that I'm buying too little, and the more BTC will grow in value, the less my return will be in 10-15 yrs. I don't really have that many funds to allocate to BTC right now and that seriously bugs me out.

I wanted to know whether you ever had this problem. Obviously, any amount of money put is already doing a good job and I always buy only the amount I'm prepared to lose. But it's hard for me to stop worrying about this - as in, not buying enough. It surely is a mental problem and I have no idea how to overcome it. Thoughts?",1740486327.0,0.5,Negative
0.0,0.97,0.03,0.1511,Crypto Taxes,"If I buy BTC on a exchange A in country X, then transfer it to a cold wallet, then transfer from my cold wallet to an exchange B in another country (this country Y, I do not have to pay taxes if I convert BTC to Fiat currency up to USD 10k per day), then I buy USDT 10k on the same exchange B, then I send it my cold wallet, then I send USDT to back to exchange C in country A, then I convert USDT to fiat currency. Do I have to pay taxes in country X?",1740408999.0,0.5,Positive
0.0,0.686,0.314,0.6705,"Looking for an open source bitcoin wallet, have any suggestions?","just this, if you can suggest anything to me , I'd be grateful. Thank you.",1740406996.0,0.5,Positive
0.078,0.82,0.102,0.252,Closed sol at 90k loss.,"Started a long position at 184 , bought the dip at 170, bought another dip at 150, and it went down all the way to $130 :)

Closed my position at -90k$ for good, I guess it's a good time to long again and cover some loss. Lesson learned.

Where do you guys think the market is headed? I haven't heard any news on why the market is down so bad, specifically Solana. Maybe the big players know some inside story. ",1740484800.0,0.47,Positive
0.0,0.737,0.263,0.8201,Not holding!,I like bitcoin but regular people can’t let their money deteriorate. I’m sure it will get better but people need to start spending btc instead of holding it. ,1740471218.0,0.45,Positive
0.0,1.0,0.0,0.0,Crypto.com,Why is the price always higher when I go to purchase the BTC?  And why is it always higher on crypto.com then on Fidelity's site?,1740432762.0,0.44,Neutral
0.053,0.789,0.158,0.6818,Why am I waiting 20hrs.,Dude sure bitcoins great and all but if I have to wait 20hrs for a transaction it's literally no better than a bank. At least I have someone to call if it's a bank. Someone tell me how the automation decides which transactions to confirm first? Or is it a fifo situation?,1740421487.0,0.36,Positive
0.033,0.837,0.129,0.7425,Dogecoin’s price per coin,"With the promise of Dogecoin news coming , now re scheduled  for the first two weeks of March, the price action presently being seen makes no sense. Even with the cryptocurrency exchange Bybit hack of over $1.5 billion, Doge should have rebounded. One thing is sure, if the expected news is very positive these prices will not be seen again.",1740410527.0,0.31,Positive
0.0,0.936,0.064,0.2263,Can I send BTC with all Networks?,"Hi. I want to send BTC from an Exchange to KuCoin. KuCoin asks me, if I want to receive via BTC, Lightning or Segwit. The exchange I am sending from doesnt show which one of these three it is. So can I choose all of these three options shown on KuCoin or do I have to use the BTC-Network?

Edit: Want to send from Bitpanda",1740476285.0,0.29,Positive
